id,"name","description","chebi_name","chebi_id","created_at","updated_at",creator_id,updater_id,"chebi_definition"778,"caspase-8 inducer","An apoptosis inducing agent that directly stimulates the activity of caspase-8, a member of the cysteine proteases, which are implicated in apoptosis and cytokine processing.",NULL,NULL,"2012-04-10 10:05:26","2015-11-11 02:32:18",NULL,NULL,NULL779,"caspase-9 inhibitor",NULL,"protease inhibitor","37670","2012-04-10 10:05:26","2015-10-27 17:52:03",NULL,NULL,"A compound which inhibits or antagonizes the biosynthesis or actions of proteases (endopeptidases)."780,"catabolic","A process, or reaction, that relesases energy which is used by anabolic reactions.",NULL,NULL,"2012-04-10 10:05:26","2015-11-11 02:32:10",NULL,NULL,NULL781,"cataractagenic","An agent that induces the formation of cataracts.",NULL,NULL,"2012-04-10 10:05:26","2015-11-11 02:32:12",NULL,NULL,NULL782,"catechol O-methyltransferase inhibitor",NULL,"catechol O-methyltransferase inhibitor","48406","2012-04-10 10:05:26","2015-10-27 17:52:03",NULL,NULL,"An EC 2.1.1.* (methyltransferase) inhibitor that interferes with the action of catechol O-methyltransferase (EC 2.1.1.6)."783,"catecholaminogenic","A chemical which functions to directly modulate the catecholamine systems in the body or brain. Examples include adrenergics and dopaminergics.",NULL,NULL,"2012-04-10 10:05:26","2015-11-11 02:32:10",NULL,NULL,NULL784,"cathartic",NULL,"cathartic","75325","2012-04-10 10:05:26","2015-10-29 22:42:37",NULL,NULL,"Any substance that accelerates defecation. Compare with laxatives, which are substances that ease defecation (usually by softening faeces). A substance can be both a laxative and a cathartic."785,"cerebrodepressant","An agent, or drug, that has a sedating effect on the brain, reducing activity and alertness and, in some instances, causing a loss of consciousness.",NULL,NULL,"2012-04-10 10:05:26","2015-11-11 02:32:16",NULL,NULL,NULL786,"cerebrophilic",NULL,NULL,NULL,"2012-04-10 10:05:26","2012-04-10 10:05:26",NULL,NULL,NULL787,"cerebroprotective","An agent or mechanism that alleviates or prevents certain conditions of the brain. An example is the autoregulation of cerebral blood flow aimed at improving neuronal survival in a changing environment. ",NULL,NULL,"2012-04-10 10:05:26","2015-11-11 02:32:11",NULL,NULL,NULL788,"cerebrostimulant","An agent, or drug, that causes an increase in activity of the central nervous system, providing a temporary sense of alertness and well-being as well as relief from fatigue.",NULL,NULL,"2012-04-10 10:05:26","2015-11-11 02:32:16",NULL,NULL,NULL789,"cerebrotonic","Relating to or resembling a personality type characterized by shyness, introspection, and emotional restraint, and often associated with an ectomorphic physique.",NULL,NULL,"2012-04-10 10:05:26","2015-11-11 02:32:19",NULL,NULL,NULL790,"cerebrotoxic",NULL,"aetiopathogenetic role","52209","2012-04-10 10:05:26","2015-10-27 17:52:04",NULL,NULL,"A role played by the molecular entity or part thereof which causes the development of a pathological process."791,"cerumenolytic","An agent that softens serumen (earwax) for removal.",NULL,NULL,"2012-04-10 10:05:26","2015-11-11 02:32:15",NULL,NULL,NULL792,"cestodicide","An agent that kills cestoda, parasitic flatworms, of the phylum Platyhelminthes.",NULL,NULL,"2012-04-10 10:05:26","2015-11-11 02:32:13",NULL,NULL,NULL793,"cGMP inhibitor",NULL,"inhibitor","35222","2012-04-10 10:05:26","2015-10-27 17:52:04",NULL,NULL,"A substance that diminishes the rate of a chemical reaction."794,"cGMP-phosphodiesterase inhibitor",NULL,"enzyme inhibitor","23924","2012-04-10 10:05:26","2015-10-27 17:52:05",NULL,NULL,"A compound or agent that combines with an enzyme in such a manner as to prevent the normal substrate-enzyme combination and the catalytic reaction."795,"chelator",NULL,"chelator","38161","2012-04-10 10:05:26","2015-10-27 17:52:05",NULL,NULL,"A ligand with two or more separate binding sites that can bind to a single metallic central atom, forming a chelate."796,"chemopreventive",NULL,"antineoplastic agent","35610","2012-04-10 10:05:26","2015-10-27 17:52:07",NULL,NULL,"A substance that inhibits or prevents the proliferation of neoplasms."797,"chemopreventive inhibitor",NULL,"inhibitor","35222","2012-04-10 10:05:26","2015-10-27 17:52:08",NULL,NULL,"A substance that diminishes the rate of a chemical reaction."798,"chitinolytic","Of, pertaining to, or relating to the enzyme converting chitin (a polysaccharide) into chitobiose (a disaccharide).",NULL,NULL,"2012-04-10 10:05:26","2015-11-11 02:32:18",NULL,NULL,NULL799,"chitosanolytic","An agent, or enzyme, that catalyzes breakdown of chitosan.",NULL,NULL,"2012-04-10 10:05:26","2015-11-11 02:32:17",NULL,NULL,NULL800,"cholagogue","An agent that promotes the discharge of bile from the system, purging it downward.",NULL,NULL,"2012-04-10 10:05:26","2015-11-11 02:32:14",NULL,NULL,NULL801,"choleretic","An agent, or substance, that increases the volume of secretion of bile from the liver as well as the amount of solids secreted.",NULL,NULL,"2012-04-10 10:05:26","2015-11-11 02:32:17",NULL,NULL,NULL802,"cholesterolytic","An agent, or enzyme, that catalyzes breakdown of cholesterol.",NULL,NULL,"2012-04-10 10:05:26","2015-11-11 02:32:17",NULL,NULL,NULL803,"choline-sparing","An agent that prevents the excretion of cholin in urine, a water-soluble nutrient grouped within the B-complex vitamins.",NULL,NULL,"2012-04-10 10:05:26","2015-11-11 02:32:13",NULL,NULL,NULL804,"cholinergic",NULL,"cholinergic drug","38323","2012-04-10 10:05:26","2015-10-27 17:52:08",NULL,NULL,"Any drug used for its actions on cholinergic systems. Included here are agonists and antagonists, drugs that affect the life cycle of acetylcholine, and drugs that affect the survival of cholinergic neurons."805,"chronotropic","An agent, or drug, that change the heart rate by affecting the nerves controlling the heart, or by changing the rhythm produced by the sinoatrial node.",NULL,NULL,"2012-04-10 10:05:26","2015-11-11 02:32:16",NULL,NULL,NULL806,"cicatrizant","An agent that promotes healing through the formation of scar tissue. For example, sandalwood is a natural cicatrizant.",NULL,NULL,"2012-04-10 10:05:26","2015-11-11 02:32:14",NULL,NULL,NULL807,"ciliotoxic","An agent that is toxic to the cilia in the lungs.",NULL,NULL,"2012-04-10 10:05:26","2015-11-11 02:32:13",NULL,NULL,NULL808,"circulatory stimulant","An agent that increases blood flow to and from tissues and organs. Circulatory stimulants are an important part of holistic treatment helping the body to rectify imbalances by bringing nutrients to an area and taking away toxins.",NULL,NULL,"2012-04-10 10:05:26","2015-11-11 02:32:12",NULL,NULL,NULL809,"circulotonic",NULL,NULL,NULL,"2012-04-10 10:05:26","2012-04-10 10:05:26",NULL,NULL,NULL810,"clastogenic","A mutagenic agent giving rise to or inducing disruption or breakages of chromosomes, leading to sections of the chromosome being deleted, added, or rearranged.",NULL,NULL,"2012-04-10 10:05:26","2015-11-11 02:32:10",NULL,NULL,NULL811,"central nervous system active",NULL,"central nervous system drug","35470","2012-04-10 10:05:26","2015-10-27 17:52:09",NULL,NULL,"A class of drugs producing both physiological and psychological effects through a variety of mechanisms involving the central nervous system."812,"central nervous system depressant",NULL,"central nervous system drug","35470","2012-04-10 10:05:26","2015-10-27 17:52:09",NULL,NULL,"A class of drugs producing both physiological and psychological effects through a variety of mechanisms involving the central nervous system."813,"central nervous system inhibitor",NULL,"central nervous system drug","35470","2012-04-10 10:05:26","2015-10-27 17:52:10",NULL,NULL,"A class of drugs producing both physiological and psychological effects through a variety of mechanisms involving the central nervous system."814,"central nervous system paralytic",NULL,"central nervous system drug","35470","2012-04-10 10:05:26","2015-10-27 17:52:10",NULL,NULL,"A class of drugs producing both physiological and psychological effects through a variety of mechanisms involving the central nervous system."815,"central nervous system sedative",NULL,"central nervous system drug","35470","2012-04-10 10:05:26","2015-10-27 17:52:11",NULL,NULL,"A class of drugs producing both physiological and psychological effects through a variety of mechanisms involving the central nervous system."816,"central nervous system stimulant",NULL,"central nervous system drug","35470","2012-04-10 10:05:27","2015-10-27 17:52:11",NULL,NULL,"A class of drugs producing both physiological and psychological effects through a variety of mechanisms involving the central nervous system."817,"central nervous system toxic",NULL,"neurotoxic agent","50910","2012-04-10 10:05:27","2015-10-27 17:52:12",NULL,NULL,"A poison that interferes with the functions of the nervous system."818,"coagulant","An agent that causes blood or another liquid to coagulate.",NULL,NULL,"2012-04-10 10:05:27","2015-11-11 02:32:12",NULL,NULL,NULL819,"cold preventive","An agent, drug or nutritional factor, that prevents development of cold symptoms, such as congestion or body aches. ",NULL,NULL,"2012-04-10 10:05:27","2015-11-11 02:32:16",NULL,NULL,NULL820,"coleopterifuge",NULL,"pesticide","25944","2012-04-10 10:05:27","2015-10-27 17:52:12",NULL,NULL,"Strictly, a substance intended to kill pests. In common usage, any substance used for controlling, preventing, or destroying animal, microbiological or plant pests."821,"coleoptophile","A substance able to kill or inhibit the activity of beetles. ",NULL,NULL,"2012-04-10 10:05:27","2015-11-11 02:32:10",NULL,NULL,NULL822,"collagen-sparing",NULL,NULL,NULL,"2012-04-10 10:05:27","2012-04-10 10:05:27",NULL,NULL,NULL823,"collagenase inhibitor",NULL,"enzyme inhibitor","23924","2012-04-10 10:05:27","2015-10-27 17:52:13",NULL,NULL,"A compound or agent that combines with an enzyme in such a manner as to prevent the normal substrate-enzyme combination and the catalytic reaction."824,"collagenic","An agent that stimulates production of collage, the fibrous protein constituent of bone, cartilage, tendon, and other connective tissue.",NULL,NULL,"2012-04-10 10:05:27","2015-11-11 02:32:15",NULL,NULL,NULL825,"collyrium","A lotion or liquid wash used as a cleanser for the eyes, particularly in diseases of the eye.",NULL,NULL,"2012-04-10 10:05:27","2015-11-11 02:32:10",NULL,NULL,NULL826,"colorant",NULL,"dye","37958","2012-04-10 10:05:27","2012-04-10 10:05:27",NULL,NULL,NULL827,"comedogenic","An agent that causes blackheads by blocking the pores of the skin.",NULL,NULL,"2012-04-10 10:05:27","2015-11-11 02:32:12",NULL,NULL,NULL828,"comedolytic","An agent that resolves comedones or prevents the formation of new comedones (skin-coloured, small bumps (papules) frequently found on the forehead and chin of those with acne).",NULL,NULL,"2012-04-10 10:05:27","2015-11-11 02:32:15",NULL,NULL,NULL829,"congestant","An agent that causes congestion, which is the act of gathering into a heap or mass (accumulation).",NULL,NULL,"2012-04-10 10:05:27","2015-11-11 02:32:12",NULL,NULL,NULL830,"contraceptive",NULL,"pharmaceutical","52217","2012-04-10 10:05:27","2015-10-27 17:52:14",NULL,NULL,"Any substance introduced into a living organism with therapeutic or diagnostic purpose."831,"controlled","The behaviour of which is supervised or regulated.",NULL,NULL,"2012-04-10 10:05:27","2015-11-11 02:32:19",NULL,NULL,NULL832,"convulsant","An agent, or drug that induces convulsions and/or epileptic seizures, the opposite of an anticonvulsant. These drugs generally act as stimulants at low doses, but are not used for this purpose due to the risk of convulsions and consequent excitotoxicity.",NULL,NULL,"2012-04-10 10:05:27","2015-11-11 02:32:16",NULL,NULL,NULL833,"copper antagonist",NULL,"antagonist","48706","2012-04-10 10:05:27","2015-10-27 17:52:14",NULL,NULL,"Substance that attaches to and blocks cell receptors that normally bind naturally occurring substances."834,"copper chelator",NULL,"chelator","38161","2012-04-10 10:05:27","2015-10-27 17:52:15",NULL,NULL,"A ligand with two or more separate binding sites that can bind to a single metallic central atom, forming a chelate."835,"coronarydilator","An agent, or drug, that dilates the coronary vessels.",NULL,NULL,"2012-04-10 10:05:27","2015-11-11 02:32:16",NULL,NULL,NULL836,"corrosive","A substance that destroys or damages other substances with which it comes into contact. It may attack a great variety of materials, including metals and various organic compounds, but people are mostly concerned with its effects on living tissue: it causes chemical burns on contact.",NULL,NULL,"2012-04-10 10:05:27","2015-11-11 02:32:10",NULL,NULL,NULL837,"corticosterogenic","An agent that stimulates the production of corticosterone, a 21-carbon steroid hormone of the corticosteroid type produced in the cortex of the adrenal glands in rodents and other non-human animals.",NULL,NULL,"2012-04-10 10:05:27","2015-11-11 02:32:16",NULL,NULL,NULL838,"cosmetic",NULL,"cosmetic","64857","2012-04-10 10:05:27","2015-10-29 22:42:53",NULL,NULL,"The role played by a substance in enhancing the appearance or odour of the human body; a name given to the substance itself or to a component of it."839,"counterirritant","An agent that creates irritation or mild inflammation in one location with the goal of lessening discomfort and/or inflammation in another location.",NULL,NULL,"2012-04-10 10:05:27","2015-11-11 02:32:12",NULL,NULL,NULL840,"cyclooxygenase-1 inhibitor",NULL,"cyclooxygenase 1 inhibitor","50630","2012-04-10 10:05:27","2015-10-27 17:52:16",NULL,NULL,"A cyclooxygenase inhibitor that interferes with the action of cyclooxygenase 1."841,"cyclooxygenase-2 inhibitor",NULL,"cyclooxygenase 2 inhibitor","50629","2012-04-10 10:05:27","2015-10-27 17:52:16",NULL,NULL,"A cyclooxygenase inhibitor that interferes with the action of cyclooxygenase 2."842,"crustacicide","An agent that kills organisms of the subphylum Crustacea.",NULL,NULL,"2012-04-10 10:05:27","2015-11-11 02:32:13",NULL,NULL,NULL843,"culicide","An agent that destroys mosquitoes.",NULL,NULL,"2012-04-10 10:05:27","2015-11-11 02:32:12",NULL,NULL,NULL844,"curare","A plant extract alkaloid poison that inhibits the nicotinic acetylcholine receptor (nAChR), which is a subtype of acetylcholine receptor found at the neuromuscular junction. This causes weakness of the skeletal muscles and, when administered in a sufficient dose, eventual death by asphyxiation due to paralysis of the diaphragm.",NULL,NULL,"2012-04-10 10:05:27","2015-11-11 02:32:10",NULL,NULL,NULL845,"cyanogenic","An agent that stimulates producing hydrogen cyanide.",NULL,NULL,"2012-04-10 10:05:27","2015-11-11 02:32:15",NULL,NULL,NULL846,"cyclin-B1 inhibitor",NULL,"inhibitor","35222","2012-04-10 10:05:27","2015-10-27 17:52:17",NULL,NULL,"A substance that diminishes the rate of a chemical reaction."847,"cyclin-D1 inhibitor",NULL,"inhibitor","35222","2012-04-10 10:05:27","2015-10-27 17:52:18",NULL,NULL,"A substance that diminishes the rate of a chemical reaction."848,"cyclooxygenase activator","An agent that stimulates the activity of cyclooxygenase, an enzyme that is responsible for formation of prostanoids, including prostaglandins such as prostacyclin and thromboxane.",NULL,NULL,"2012-04-10 10:05:27","2015-11-11 02:32:15",NULL,NULL,NULL849,"cyclooxygenase inhibitor",NULL,"cyclooxygenase inhibitor","35544","2012-04-10 10:05:27","2015-10-27 17:52:18",NULL,NULL,"A compound or agent that combines with cyclooxygenases (EC 1.14.99.1) and thereby prevents its substrate-enzyme combination with arachidonic acid and the formation of icosanoids, prostaglandins, and thromboxanes."850,"cytochrome-CYP1A1 inhibitor",NULL,"inhibitor","35222","2012-04-10 10:05:27","2015-10-27 17:52:19",NULL,NULL,"A substance that diminishes the rate of a chemical reaction."851,"cytochrome-P450-1A1 inhibitor",NULL,"P450 inhibitor","50183","2012-04-10 10:05:27","2015-10-27 17:52:19",NULL,NULL,"An enzyme inhibitor that interferes with the activity of cytochrome P450 involved in catalysis of organic substances."852,"cytochrome-P450-1A2 inhibitor",NULL,"P450 inhibitor","50183","2012-04-10 10:05:27","2015-10-27 17:52:20",NULL,NULL,"An enzyme inhibitor that interferes with the activity of cytochrome P450 involved in catalysis of organic substances."853,"cytochrome-P450-2E1 inhibitor",NULL,"P450 inhibitor","50183","2012-04-10 10:05:27","2015-10-27 17:52:20",NULL,NULL,"An enzyme inhibitor that interferes with the activity of cytochrome P450 involved in catalysis of organic substances."854,"cytochrome-p450 inducer","An agent that stimulates the activity of cytochrome-p450 enzymes, hemoproteins that act for example as terminal oxidase enzymes in electron transfer chains.",NULL,NULL,"2012-04-10 10:05:27","2015-11-11 02:32:15",NULL,NULL,NULL855,"cytochrome-P450 inhibitor",NULL,"P450 inhibitor","50183","2012-04-10 10:05:27","2015-10-27 17:52:21",NULL,NULL,"An enzyme inhibitor that interferes with the activity of cytochrome P450 involved in catalysis of organic substances."856,"cytochrome-p488 inducer","An agent that stimulates the activity of cytochrome-p488 enzymes, isoenzymes of cytochrome-p450.",NULL,NULL,"2012-04-10 10:05:27","2015-11-11 02:32:15",NULL,NULL,NULL857,"cytoprotective","An agent that protects cells from noxious chemicals or other stimuli.",NULL,NULL,"2012-04-10 10:05:27","2015-11-11 02:32:14",NULL,NULL,NULL858,"cytostatic","An agent that inhibits cell growth.",NULL,NULL,"2012-04-10 10:05:27","2015-11-11 02:32:12",NULL,NULL,NULL859,"cytotoxic",NULL,"aetiopathogenetic role","52209","2012-04-10 10:05:27","2015-10-27 17:52:21",NULL,NULL,"A role played by the molecular entity or part thereof which causes the development of a pathological process."860,"decalcifier","An agent, or solution, that has the ability to remove calcium or calcium compounds form a target, such as bones or teeth.",NULL,NULL,"2012-04-10 10:05:27","2015-11-11 02:32:17",NULL,NULL,NULL861,"decarboxylase inhibitor",NULL,"enzyme inhibitor","23924","2012-04-10 10:05:27","2015-10-27 17:52:22",NULL,NULL,"A compound or agent that combines with an enzyme in such a manner as to prevent the normal substrate-enzyme combination and the catalytic reaction."862,"decongestant",NULL,"nasal decongestant","77715","2012-04-10 10:05:27","2015-10-29 22:43:21",NULL,NULL,"A drug used to relieve nasal congestion in the upper respiratory tract."863,"degranulant","An agent that stimulates the loss or release of granules of a substance, typically as part of an immune reaction.",NULL,NULL,"2012-04-10 10:05:27","2015-11-11 02:32:16",NULL,NULL,NULL864,"dehydrogenase inhibitor",NULL,"enzyme inhibitor","23924","2012-04-10 10:05:27","2015-10-27 17:52:22",NULL,NULL,"A compound or agent that combines with an enzyme in such a manner as to prevent the normal substrate-enzyme combination and the catalytic reaction."865,"deiodinase inhibitor",NULL,"enzyme inhibitor","23924","2012-04-10 10:05:27","2015-10-27 17:52:23",NULL,NULL,"A compound or agent that combines with an enzyme in such a manner as to prevent the normal substrate-enzyme combination and the catalytic reaction."866,"deliriant","A class of hallucinogen that are unique in that, even with lower doses, they offer solid hallucinations which display themselves seamlessly into waking consciousness, similar to fully formed dreams or delusions.",NULL,NULL,"2012-04-10 10:05:27","2015-11-11 02:32:10",NULL,NULL,NULL867,"delta9-desaturase inhibitor",NULL,"enzyme inhibitor","23924","2012-04-10 10:05:27","2015-10-27 17:52:23",NULL,NULL,"A compound or agent that combines with an enzyme in such a manner as to prevent the normal substrate-enzyme combination and the catalytic reaction."868,"demulcent","An agent that forms a soothing film over a mucous membrane, relieving minor pain and inflammation of the membrane.",NULL,NULL,"2012-04-10 10:05:27","2015-11-11 02:32:12",NULL,NULL,NULL869,"dentifrice","An agent used along with a toothbrush to clean and polish natural teeth.",NULL,NULL,"2012-04-10 10:05:27","2015-11-11 02:32:16",NULL,NULL,NULL870,"deodorant","A substance that removes or conceals unpleasant smells, especially bodily odors.",NULL,NULL,"2012-04-10 10:05:27","2015-11-11 02:32:10",NULL,NULL,NULL871,"depigmentor","A pigment suppresing agent that has a lightening effect on skin.",NULL,NULL,"2012-04-10 10:05:27","2015-11-11 02:32:10",NULL,NULL,NULL872,"depressant","An agent, or drug that lowers neurotransmission levels, which is to depress or reduce arousal or stimulation, in various areas of the brain.",NULL,NULL,"2012-04-10 10:05:27","2015-11-11 02:32:16",NULL,NULL,NULL873,"depressor","A muscle whose contraction pulls down the part of the body to which it is attached, or a nerve whose stimulation results in a lowering of blood pressure.",NULL,NULL,"2012-04-10 10:05:27","2015-11-11 02:32:10",NULL,NULL,NULL874,"dermal",NULL,"dermatologic drug","50177","2012-04-10 10:05:27","2015-10-27 17:52:24",NULL,NULL,"A drug used to treat or prevent skin disorders or for the routine care of skin."875,"dermatitigenic","An agent that causes inflammation of the skin (dermatitis).",NULL,NULL,"2012-04-10 10:05:27","2015-11-11 02:32:12",NULL,NULL,NULL876,"desmutagenic","An agent, or compound, acting directly on a mutagen to decrease its mutagenicity.",NULL,NULL,"2012-04-10 10:05:27","2015-11-11 02:32:16",NULL,NULL,NULL877,"detoxicant",NULL,"antidote","50247","2012-04-10 10:05:28","2015-10-27 17:52:24",NULL,NULL,"Any protective agent counteracting or neutralizing the action of poisons."878,"diagnostic",NULL,"diagnostic agent","33295","2012-04-10 10:05:28","2015-10-29 22:43:25",NULL,NULL,"A substance administered to aid diagnosis of a disease."879,"diaphoretic","An agent, or drug, that induces perspiration.",NULL,NULL,"2012-04-10 10:05:28","2015-11-11 02:32:16",NULL,NULL,NULL880,"differentiator",NULL,NULL,NULL,"2012-04-10 10:05:28","2012-04-10 10:05:28",NULL,NULL,NULL881,"digestive","An agent that aids with digestion, the breakdown of food into smaller and smaller components which can be absorbed and assimilated into the body.",NULL,NULL,"2012-04-10 10:05:28","2015-11-11 02:32:11",NULL,NULL,NULL882,"disinfectant",NULL,"disinfectant","48219","2012-04-10 10:05:28","2015-10-29 22:43:27",NULL,NULL,"An antimicrobial agent that is applied to non-living objects to destroy harmful microorganisms or to inhibit their activity."883,"diuretic",NULL,"diuretic","35498","2012-04-10 10:05:28","2015-10-27 17:52:25",NULL,NULL,"An agent that promotes the excretion of urine through its effects on kidney function."884,"diabetic-macular-edema inhibitor",NULL,"inhibitor","35222","2012-04-10 10:05:28","2015-10-27 17:52:26",NULL,NULL,"A substance that diminishes the rate of a chemical reaction."885,"DNA-active",NULL,NULL,NULL,"2012-04-10 10:05:28","2012-04-10 10:05:28",NULL,NULL,NULL886,"DNA-binder","An agent, or protein, that is composed of DNA-binding domains and thus has a specific or general affinity for either single or double stranded DNA.",NULL,NULL,"2012-04-10 10:05:28","2015-11-11 02:32:17",NULL,NULL,NULL887,"DNA-protective","An agent, such as a herbal extract, that ameliorates or prevents DNA damage in an organism.",NULL,NULL,"2012-04-10 10:05:28","2015-11-11 02:32:17",NULL,NULL,NULL888,"DOPA-decarboxylase inhibitor",NULL,"enzyme inhibitor","23924","2012-04-10 10:05:28","2015-10-27 17:52:26",NULL,NULL,"A compound or agent that combines with an enzyme in such a manner as to prevent the normal substrate-enzyme combination and the catalytic reaction."889,"dopamine-adenylate-cyclase inhibitor",NULL,"enzyme inhibitor","23924","2012-04-10 10:05:28","2015-10-27 17:52:27",NULL,NULL,"A compound or agent that combines with an enzyme in such a manner as to prevent the normal substrate-enzyme combination and the catalytic reaction."890,"dopamine blocker",NULL,"dopaminergic agent","48560","2012-04-10 10:05:28","2015-10-27 17:52:27",NULL,NULL,"A drug used for its effects on dopamine receptors, on the life cycle of dopamine, or on the survival of dopaminergic neurons."891,"dopaminergic",NULL,"dopaminergic agent","48560","2012-04-10 10:05:28","2015-10-27 17:52:28",NULL,NULL,"A drug used for its effects on dopamine receptors, on the life cycle of dopamine, or on the survival of dopaminergic neurons."892,"copaminigenic",NULL,"dopaminergic agent","48560","2012-04-10 10:05:28","2015-10-27 17:52:28",NULL,NULL,"A drug used for its effects on dopamine receptors, on the life cycle of dopamine, or on the survival of dopaminergic neurons."893,"dye",NULL,"dye","37958","2012-04-10 10:05:28","2012-04-10 10:05:28",NULL,NULL,NULL894,"ecbolic","An agent that induces contractions of the uterus leading to expulsion of a fetus.",NULL,NULL,"2012-04-10 10:05:28","2015-11-11 02:32:12",NULL,NULL,NULL895,"ectoparasiticide",NULL,"ectoparasiticide","38956","2012-04-10 10:05:28","2015-10-29 22:43:28",NULL,NULL,NULL896,"edemagenic","An agent that elicits edema by causing capillary damage but not the cellular response of true inflammation.",NULL,NULL,"2012-04-10 10:05:28","2015-11-11 02:32:12",NULL,NULL,NULL897,"elastase inhibitor",NULL,"enzyme inhibitor","23924","2012-04-10 10:05:28","2015-10-27 17:52:29",NULL,NULL,"A compound or agent that combines with an enzyme in such a manner as to prevent the normal substrate-enzyme combination and the catalytic reaction."898,"embryotoxic",NULL,"aetiopathogenetic role","52209","2012-04-10 10:05:28","2015-10-27 17:52:30",NULL,NULL,"A role played by the molecular entity or part thereof which causes the development of a pathological process."899,"emetic","An agent that causes vomiting.",NULL,NULL,"2012-04-10 10:05:28","2015-11-11 02:32:12",NULL,NULL,NULL