id,"name","description","chebi_name","chebi_id","created_at","updated_at",creator_id,updater_id,"chebi_definition"1,"(+)-inotropic","An agent that alters the force or energy of muscular contractions. Positively inotropic agents increase the strength of muscular contraction.",NULL,NULL,"2012-04-10 10:05:13","2015-11-11 02:32:19",NULL,NULL,NULL2,"(-)-chronotropic","An agent that may change the heart rate by affecting the nerves controlling the heart, or by changing the rhythm produced by the sinoatrial node. Negative chronotropes decrease heart rate.",NULL,NULL,"2012-04-10 10:05:13","2015-11-11 02:32:19",NULL,NULL,NULL3,"(-)-inotropic","An agent that alters the force or energy of muscular contractions. Negatively inotropic agents weaken the force of muscular contractions.",NULL,NULL,"2012-04-10 10:05:13","2015-11-11 02:32:19",NULL,NULL,NULL4,"11beta-hydroxysteroid-dehydrogenase inhibitor",NULL,"enzyme inhibitor","23924","2012-04-10 10:05:13","2015-10-27 17:47:35",NULL,NULL,"A compound or agent that combines with an enzyme in such a manner as to prevent the normal substrate-enzyme combination and the catalytic reaction."5,"12-lipoxygenase inhibitor",NULL,"enzyme inhibitor","23924","2012-04-10 10:05:13","2015-10-27 17:47:36",NULL,NULL,"A compound or agent that combines with an enzyme in such a manner as to prevent the normal substrate-enzyme combination and the catalytic reaction."6,"17beta-hydroxysteroid-dehydrogenase inhibitor",NULL,"enzyme inhibitor","23924","2012-04-10 10:05:13","2015-10-27 17:47:37",NULL,NULL,"A compound or agent that combines with an enzyme in such a manner as to prevent the normal substrate-enzyme combination and the catalytic reaction."7,"5alpha-reductase inhibitor",NULL,"5alpha-reductase inhibitor","50781","2012-04-10 10:05:13","2015-10-27 17:47:37",NULL,NULL,"An EC 1.3.1.* (oxidoreductase acting on CH-CH group of donor, NAD(+) or NADP(+) as acceptor) inhibitor that interferes with the action of of 3-oxo-5alpha-steroid 4-dehydrogenase (NADP(+)), EC 1.3.1.22, the enzyme which converts testosterone (CHEBI:17347) into the more potent androgen 5alpha-dihydrotestosterone."8,"5-hydroxyeicosatetraenoic-acid inhibitor",NULL,"inhibitor","35222","2012-04-10 10:05:13","2015-10-27 17:47:38",NULL,NULL,"A substance that diminishes the rate of a chemical reaction."9,"5-hydroxytryptamine inhibitor",NULL,"serotonergic antagonist","48279","2012-04-10 10:05:13","2015-10-27 17:47:38",NULL,NULL,"Drugs that bind to but do not activate serotonin receptors, thereby blocking the actions of serotonin or serotonergic agonists."10,"5-lipoxygenase inhibitor",NULL,"enzyme inhibitor","23924","2012-04-10 10:05:13","2015-10-27 17:47:39",NULL,NULL,"A compound or agent that combines with an enzyme in such a manner as to prevent the normal substrate-enzyme combination and the catalytic reaction."11,"8-hydroxyeicosatetraenoic-acid inhibitor",NULL,"inhibitor","35222","2012-04-10 10:05:13","2015-10-27 17:47:40",NULL,NULL,"A substance that diminishes the rate of a chemical reaction."12,"beta inhibitor",NULL,"inhibitor","35222","2012-04-10 10:05:13","2015-10-27 17:47:40",NULL,NULL,"A substance that diminishes the rate of a chemical reaction."13,"abortifacient",NULL,"abortifacient","50691","2012-04-10 10:05:14","2015-10-29 22:40:58",NULL,NULL,"A chemical substance that interrupts pregnancy after implantation."14,"absorbent","A substance or item able to soak liquid easily.",NULL,NULL,"2012-04-10 10:05:14","2015-11-11 02:32:10",NULL,NULL,NULL15,"acantholytic","Causing loss of intercellular connections, such as desmosomes, resulting in loss of cohesion between keratinocytes.",NULL,NULL,"2012-04-10 10:05:14","2015-11-11 02:32:18",NULL,NULL,NULL16,"acaricide",NULL,"acaricide","22153","2012-04-10 10:05:14","2015-10-27 17:47:41",NULL,NULL,"A substance used to destroy pests of the subclass Acari (mites and ticks)."17,"acarifuge",NULL,"pesticide","25944","2012-04-10 10:05:14","2015-10-27 17:47:41",NULL,NULL,"Strictly, a substance intended to kill pests. In common usage, any substance used for controlling, preventing, or destroying animal, microbiological or plant pests."18,"angiotensin converting enzyme inhibitor",NULL,"angiotensin-converting enzyme inhibitor","35457","2012-04-10 10:05:14","2015-10-27 17:47:42",NULL,NULL,"An EC 3.4.15.* (peptidyl-dipeptidase) inhibitor that interferes with the action of peptidyl-dipeptidase A (EC 3.4.15.1)."19,"acetyl-CoA-carboxylase inhibitor",NULL,"enzyme inhibitor","23924","2012-04-10 10:05:14","2015-10-27 17:47:42",NULL,NULL,"A compound or agent that combines with an enzyme in such a manner as to prevent the normal substrate-enzyme combination and the catalytic reaction."20,"acetylcholinergic",NULL,"cholinergic drug","38323","2012-04-10 10:05:14","2015-10-27 17:47:43",NULL,NULL,"Any drug used for its actions on cholinergic systems. Included here are agonists and antagonists, drugs that affect the life cycle of acetylcholine, and drugs that affect the survival of cholinergic neurons."21,"acetylcholinesterase inhibitor",NULL,"acetylcholinesterase inhibitor","38462","2012-04-10 10:05:14","2015-10-27 17:47:44",NULL,NULL,"An EC 3.1.1.* (carboxylic ester hydrolase) inhibitor that interferes with the action of enzyme acetylcholinesterase (EC 3.1.1.7), which helps breaking down of acetylcholine into choline and acetic acid."22,"acidifier",NULL,"food additive","64047","2012-04-10 10:05:14","2015-10-27 17:47:44",NULL,NULL,"Any substance which is added to food to preserve or enhance its flavour and/or appearance."23,"acidulant",NULL,"food additive","64047","2012-04-10 10:05:14","2015-10-27 17:47:45",NULL,NULL,"Any substance which is added to food to preserve or enhance its flavour and/or appearance."24,"acnegenic",NULL,"aetiopathogenetic role","52209","2012-04-10 10:05:14","2015-10-27 17:47:45",NULL,NULL,"A role played by the molecular entity or part thereof which causes the development of a pathological process."25,"adaptogenic","A substance or compounds that results in stabilization of physiological processes and promotion of homeostasis, an example being by decreased cellular sensitivity to stress.",NULL,NULL,"2012-04-10 10:05:14","2015-11-11 02:32:10",NULL,NULL,NULL26,"addictive","A substance causing dependency, in spite of effects.",NULL,NULL,"2012-04-10 10:05:14","2015-11-11 02:32:10",NULL,NULL,NULL27,"additive",NULL,"food additive","64047","2012-04-10 10:05:14","2015-10-29 22:41:00",NULL,NULL,"Any substance which is added to food to preserve or enhance its flavour and/or appearance."28,"adenosine antagonist",NULL,"antagonist","48706","2012-04-10 10:05:14","2015-10-27 17:47:46",NULL,NULL,"Substance that attaches to and blocks cell receptors that normally bind naturally occurring substances."29,"adenylate-cyclase inhibitor",NULL,"enzyme inhibitor","23924","2012-04-10 10:05:14","2015-10-27 17:47:46",NULL,NULL,"A compound or agent that combines with an enzyme in such a manner as to prevent the normal substrate-enzyme combination and the catalytic reaction."30,"adjuvant",NULL,"adjuvant","60809","2012-04-10 10:05:14","2015-10-29 22:41:00",NULL,NULL,"Any pharmacological or immunological agent that modifies the effect of other agents such as drugs or vaccines while having few if any direct effects when given by itself."31,"adrenergic",NULL,"adrenergic agent","37962","2012-04-10 10:05:14","2015-10-27 17:47:47",NULL,NULL,"Any agent that acts on an adrenergic receptor or affects the life cycle of an adrenergic transmitter."32,"aedifuge",NULL,"pesticide","25944","2012-04-10 10:05:14","2015-10-27 17:47:47",NULL,NULL,"Strictly, a substance intended to kill pests. In common usage, any substance used for controlling, preventing, or destroying animal, microbiological or plant pests."33,"advanced glycation end products inhibitor",NULL,"inhibitor","35222","2012-04-10 10:05:14","2015-10-27 17:47:48",NULL,NULL,"A substance that diminishes the rate of a chemical reaction."34,"aggregant","An agent that promotes conjugation or collection of particulars into a whole.",NULL,NULL,"2012-04-10 10:05:14","2015-11-11 02:32:14",NULL,NULL,NULL35,"aryl-hydrocarbon-hydroxylase inhibitor",NULL,"enzyme inhibitor","23924","2012-04-10 10:05:14","2015-10-27 17:47:48",NULL,NULL,"A compound or agent that combines with an enzyme in such a manner as to prevent the normal substrate-enzyme combination and the catalytic reaction."36,"serine/threonine kinase inhibitor",NULL,"serine/threonine kinase inhibitor","50925","2012-04-10 10:05:14","2015-10-27 17:47:49",NULL,NULL,"An EC 2.7.11.* (protein-serine/threonine kinase) inhibitor that interferes with the action of non-specific serine/threonine protein kinase (EC 2.7.11.1), a kinase enzyme involved in phosphorylation of hydroxy group of serine or threonine."37,"albuminurigenic",NULL,NULL,NULL,"2012-04-10 10:05:14","2012-04-10 10:05:14",NULL,NULL,NULL38,"alcohol dehydrogenase inhibitor",NULL,"alcohol dehydrogenase inhibitor","50269","2012-04-10 10:05:14","2015-10-27 17:47:49",NULL,NULL,"An EC 1.1.1.* (oxidoreductase acting on donor CH-OH group, NAD(+) or NADP(+) acceptor) inhibitor that interferes with the action of alcohol dehydrogenase (EC 1.1.1.1)."39,"aldehyde-oxidase inhibitor",NULL,"enzyme inhibitor","23924","2012-04-10 10:05:14","2015-10-27 17:47:50",NULL,NULL,"A compound or agent that combines with an enzyme in such a manner as to prevent the normal substrate-enzyme combination and the catalytic reaction."40,"aldose reductase inhibitor",NULL,"aldose reductase inhibitor","48550","2012-04-10 10:05:14","2015-10-27 17:47:50",NULL,NULL,"An EC 1.1.1.* (oxidoreductase acting on donor CH-OH group, NAD(+) or NADP(+) acceptor) inhibitor that interferes with the action of aldehyde reductase (EC 1.1.1.21)."41,"allelochemic","Chemicals, released from plants, that cause an interaction between plants and other living organisms.",NULL,NULL,"2012-04-10 10:05:14","2015-11-11 02:32:18",NULL,NULL,NULL42,"allelopathic","Biochemicals produced by an organism that influence the growth, survival, and reproduction of other organisms.",NULL,NULL,"2012-04-10 10:05:14","2015-11-11 02:32:18",NULL,NULL,NULL43,"allergenic",NULL,"allergenic agent","50904","2012-04-10 10:05:14","2015-10-27 17:47:51",NULL,NULL,"A chemical compound which causes the onset of an allergic reaction by interacting with any of the molecular pathways involved in an allergy."44,"alpha-amylase inhibitor",NULL,"alpha-amylase inhibitor","50627","2012-04-10 10:05:14","2015-10-27 17:47:52",NULL,NULL,"An EC 3.2.1.* (glycosidase) inhibitor that interferes with the action of alpha-amylase (EC 3.2.1.1)."45,"alpha-glucosidase inhibitor",NULL,"alpha-glucoside hydrolase inhibitor","50628","2012-04-10 10:05:14","2015-10-27 17:47:52",NULL,NULL,"An EC 3.2.1.* (glycosidase) inhibitor that interferes with the action of alpha-glucosidase (EC 3.2.1.20)."46,"alpha-reductase inhibitor",NULL,"enzyme inhibitor","23924","2012-04-10 10:05:14","2015-10-27 17:47:53",NULL,NULL,"A compound or agent that combines with an enzyme in such a manner as to prevent the normal substrate-enzyme combination and the catalytic reaction."47,"amblyopic","A toxic sunstance causing amblyopia by damaging the optic nerve, such as lead, methanol, antifreeze, or certain drugs.",NULL,NULL,"2012-04-10 10:05:14","2015-11-11 02:32:11",NULL,NULL,NULL48,"amebicide",NULL,"antimicrobial agent","33281","2012-04-10 10:05:14","2015-10-27 17:47:53",NULL,NULL,"A substance that kills or slows the growth of microorganisms, including bacteria, viruses, fungi and protozoans."49,"amnesigenic",NULL,"aetiopathogenetic role","52209","2012-04-10 10:05:14","2015-10-27 17:47:54",NULL,NULL,"A role played by the molecular entity or part thereof which causes the development of a pathological process."50,"amphetaminagenic",NULL,NULL,NULL,"2012-04-10 10:05:14","2012-04-10 10:05:14",NULL,NULL,NULL51,"amphiestrogenic",NULL,NULL,NULL,"2012-04-10 10:05:14","2012-04-10 10:05:14",NULL,NULL,NULL52,"amphiglycemic","An agent that stabilizes blood sugar levels.",NULL,NULL,"2012-04-10 10:05:14","2015-11-11 02:32:15",NULL,NULL,NULL53,"amphitensive",NULL,NULL,NULL,"2012-04-10 10:05:14","2012-04-10 10:05:14",NULL,NULL,NULL54,"anabolic",NULL,"anabolic agent","36413","2012-04-10 10:05:14","2015-10-29 22:41:03",NULL,NULL,"A compound which stimulates anabolism and inhibits catabolism. Anabolic agents stimulate the development of muscle mass, strength, and power."55,"analeptic",NULL,"central nervous system stimulant","35337","2012-04-10 10:05:14","2015-10-29 22:41:03",NULL,NULL,"Any drug that enhances the activity of the central nervous system."56,"analgesic",NULL,"analgesic","35480","2012-04-10 10:05:14","2015-10-27 17:47:54",NULL,NULL,"An agent capable of relieving pain without the loss of consciousness or without producing anaesthesia. In addition, analgesic is a role played by a compound which is exhibited by a capability to cause a reduction of pain symptoms."57,"anaphrodisiac","An agent that quells or blunts the libido.",NULL,NULL,"2012-04-10 10:05:14","2015-11-11 02:32:14",NULL,NULL,NULL58,"anaphylactic","Allergent causing anaphylaxis, an allergic reaction with symptoms such as itchy rash, throat swelling, low blood pressure.",NULL,NULL,"2012-04-10 10:05:14","2015-11-11 02:32:11",NULL,NULL,NULL59,"ancylostomicide","An agent destructive to Ancylostoma genus of nematodes.",NULL,NULL,"2012-04-10 10:05:14","2015-11-11 02:32:11",NULL,NULL,NULL60,"androgenic","An agent, usually a steroid hormone, that stimulates or controls the development and maintenance of male characteristics in vertebrates by binding to androgen receptors. This includes the activity of the accessory male sex organs and development of male secondary sex characteristics.",NULL,NULL,"2012-04-10 10:05:14","2015-11-11 02:32:17",NULL,NULL,NULL61,"anemiagenic","An agent causing anemia. For example, arsenic can cause hemolytic anemia.",NULL,NULL,"2012-04-10 10:05:14","2015-11-11 02:32:11",NULL,NULL,NULL62,"anesthetic","A drug that causes anesthesia, a reversible loss of sensation.",NULL,NULL,"2012-04-10 10:05:14","2015-11-11 02:32:10",NULL,NULL,NULL63,"angiogenic",NULL,"angiogenesis inducing agent","50927","2012-04-10 10:05:14","2015-10-27 17:47:55",NULL,NULL,"An agent that induces or stimulates the physiologic angiogenesis process."64,"angiotensin receptor blocker",NULL,"angiotensin receptor antagonist","61016","2012-04-10 10:05:14","2015-10-27 17:47:55",NULL,NULL,"A hormone antagonist that blocks angiotensin receptors."65,"anhydrotic","An agent that suppresses sweating. Denoting a reduction or absence of sweat glands, characteristic of congenital ectodermal defect and anhidrotic ectodermal dysplasia.",NULL,NULL,"2012-04-10 10:05:14","2015-11-11 02:32:16",NULL,NULL,NULL66,"ankylostomacide",NULL,"pharmaceutical","52217","2012-04-10 10:05:14","2015-10-27 17:47:56",NULL,NULL,"Any substance introduced into a living organism with therapeutic or diagnostic purpose."67,"anorectic",NULL,"appetite regulator","50780","2012-04-10 10:05:14","2015-10-27 17:47:56",NULL,NULL,"An agent which regulates the physiologic mechanisms that control the appetite and food intake."68,"anorexic",NULL,"appetite regulator","50780","2012-04-10 10:05:14","2015-10-27 17:47:57",NULL,NULL,"An agent which regulates the physiologic mechanisms that control the appetite and food intake."69,"autonomic nervous system paralytic",NULL,"pharmaceutical","52217","2012-04-10 10:05:14","2015-10-27 17:47:57",NULL,NULL,"Any substance introduced into a living organism with therapeutic or diagnostic purpose."70,"autonomic nervous system stimulant",NULL,"pharmaceutical","52217","2012-04-10 10:05:14","2015-10-27 17:47:58",NULL,NULL,"Any substance introduced into a living organism with therapeutic or diagnostic purpose."71,"ant repellent",NULL,"insecticide","24852","2012-04-10 10:05:14","2015-10-27 17:47:58",NULL,NULL,"Strictly, a substance intended to kill members of the class Insecta.  In common usage, any substance used for preventing, destroying, repelling or controlling insects."72,"anti helmintic",NULL,"antimicrobial agent","33281","2012-04-10 10:05:14","2015-10-27 17:47:59",NULL,NULL,"A substance that kills or slows the growth of microorganisms, including bacteria, viruses, fungi and protozoans."73,"anti 5-hydroxytryptamine",NULL,"serotonergic antagonist","48279","2012-04-10 10:05:14","2015-10-27 17:48:00",NULL,NULL,"Drugs that bind to but do not activate serotonin receptors, thereby blocking the actions of serotonin or serotonergic agonists."74,"anti LDL",NULL,"inhibitor","35222","2012-04-10 10:05:14","2015-10-27 17:48:01",NULL,NULL,"A substance that diminishes the rate of a chemical reaction."75,"anti acetylcholine",NULL,"cholinergic drug","38323","2012-04-10 10:05:14","2015-10-27 17:48:01",NULL,NULL,"Any drug used for its actions on cholinergic systems. Included here are agonists and antagonists, drugs that affect the life cycle of acetylcholine, and drugs that affect the survival of cholinergic neurons."76,"anti acetylcholinesterase",NULL,"acetylcholinesterase inhibitor","38462","2012-04-10 10:05:14","2015-10-27 17:48:02",NULL,NULL,"An EC 3.1.1.* (carboxylic ester hydrolase) inhibitor that interferes with the action of enzyme acetylcholinesterase (EC 3.1.1.7), which helps breaking down of acetylcholine into choline and acetic acid."77,"anti acid","A substance that neutralizes acidity, such as stomach acidity that causes heartburn.",NULL,NULL,"2012-04-10 10:05:15","2015-11-11 02:32:10",NULL,NULL,NULL78,"anti acne",NULL,"dermatologic drug","50177","2012-04-10 10:05:15","2015-10-27 17:48:02",NULL,NULL,"A drug used to treat or prevent skin disorders or for the routine care of skin."79,"anti acrocyanotic",NULL,"pharmaceutical","52217","2012-04-10 10:05:15","2015-10-27 17:48:03",NULL,NULL,"Any substance introduced into a living organism with therapeutic or diagnostic purpose."80,"anti acrodermatitic",NULL,"dermatologic drug","50177","2012-04-10 10:05:15","2015-10-27 17:48:03",NULL,NULL,"A drug used to treat or prevent skin disorders or for the routine care of skin."81,"anti acrodynic",NULL,"dermatologic drug","50177","2012-04-10 10:05:15","2015-10-27 17:48:04",NULL,NULL,"A drug used to treat or prevent skin disorders or for the routine care of skin."82,"anti acromegalic","An agent that suppresses the over production of growth hormone related to acromegaly.",NULL,NULL,"2012-04-10 10:05:15","2015-11-11 02:32:16",NULL,NULL,NULL83,"anti ADD","A drug used to treat attention deficit disorder, often a stimulant that promotes concentration and attention.",NULL,NULL,"2012-04-10 10:05:15","2015-11-11 02:32:10",NULL,NULL,NULL84,"anti Addisonian","An agent, often a steroid, used to manage addison's disease characterized by underactivity of the adrenal glands.",NULL,NULL,"2012-04-10 10:05:15","2015-11-11 02:32:16",NULL,NULL,NULL85,"anti adenoma carcinogenic",NULL,"antineoplastic agent","35610","2012-04-10 10:05:15","2015-10-27 17:48:08",NULL,NULL,"A substance that inhibits or prevents the proliferation of neoplasms."86,"anti adenomic",NULL,"antineoplastic agent","35610","2012-04-10 10:05:15","2015-10-27 17:48:09",NULL,NULL,"A substance that inhibits or prevents the proliferation of neoplasms."87,"anti adenoviral",NULL,"antiviral agent","22587","2012-04-10 10:05:15","2015-10-27 17:48:10",NULL,NULL,"A substance that destroys or inhibits replication of viruses."88,"anti adenovirus",NULL,"antiviral agent","22587","2012-04-10 10:05:15","2015-10-27 17:48:10",NULL,NULL,"A substance that destroys or inhibits replication of viruses."89,"anti adhesive","An agent that prevents adhesion, or the clinging together of dissimilar particles or surfaces.",NULL,NULL,"2012-04-10 10:05:15","2015-11-11 02:32:13",NULL,NULL,NULL90,"anti adrenalinic",NULL,"adrenergic agent","37962","2012-04-10 10:05:15","2015-10-27 17:48:11",NULL,NULL,"Any agent that acts on an adrenergic receptor or affects the life cycle of an adrenergic transmitter."91,"anti adrenergic",NULL,"adrenergic agent","37962","2012-04-10 10:05:15","2015-10-27 17:48:12",NULL,NULL,"Any agent that acts on an adrenergic receptor or affects the life cycle of an adrenergic transmitter."92,"anti aflatoxin",NULL,"inhibitor","35222","2012-04-10 10:05:15","2015-10-27 17:48:12",NULL,NULL,"A substance that diminishes the rate of a chemical reaction."93,"anti advanced glycation end products",NULL,"pharmaceutical","52217","2012-04-10 10:05:15","2015-10-27 17:48:13",NULL,NULL,"Any substance introduced into a living organism with therapeutic or diagnostic purpose."94,"anti aggregant","An agent that prevents the conjugation or collection of particulars into a whole.",NULL,NULL,"2012-04-10 10:05:15","2015-11-11 02:32:13",NULL,NULL,NULL95,"anti aging",NULL,"pharmaceutical","52217","2012-04-10 10:05:15","2015-10-27 17:48:13",NULL,NULL,"Any substance introduced into a living organism with therapeutic or diagnostic purpose."96,"anti AIDS",NULL,"antiviral agent","22587","2012-04-10 10:05:15","2015-10-27 17:48:14",NULL,NULL,"A substance that destroys or inhibits replication of viruses."97,"anti akathisic",NULL,"pharmaceutical","52217","2012-04-10 10:05:15","2015-10-27 17:48:14",NULL,NULL,"Any substance introduced into a living organism with therapeutic or diagnostic purpose."98,"anti alcoholic",NULL,"pharmaceutical","52217","2012-04-10 10:05:15","2015-10-27 17:48:15",NULL,NULL,"Any substance introduced into a living organism with therapeutic or diagnostic purpose."99,"anti aldosteronic",NULL,"pharmaceutical","52217","2012-04-10 10:05:15","2015-10-27 17:48:15",NULL,NULL,"Any substance introduced into a living organism with therapeutic or diagnostic purpose."100,"anti alkali","An agent that reduces the pH of a solution.",NULL,NULL,"2012-04-10 10:05:15","2015-11-11 02:32:14",NULL,NULL,NULL101,"anti alkalotic","An agent that relieves excessively alkiline conditions of body fluids or tissues that may cause weakness or cramps.",NULL,NULL,"2012-04-10 10:05:15","2015-11-11 02:32:14",NULL,NULL,NULL102,"anti allergenic",NULL,"anti-allergic drug","50857","2012-04-10 10:05:15","2015-10-27 17:48:16",NULL,NULL,"A drug used to treat allergic reactions."103,"anti allergic",NULL,"anti-allergic drug","50857","2012-04-10 10:05:15","2015-10-27 17:48:17",NULL,NULL,"A drug used to treat allergic reactions."104,"anti alopecic",NULL,"pharmaceutical","52217","2012-04-10 10:05:15","2015-10-27 17:48:17",NULL,NULL,"Any substance introduced into a living organism with therapeutic or diagnostic purpose."105,"anti Alzheimeran",NULL,"pharmaceutical","52217","2012-04-10 10:05:15","2015-10-27 17:48:18",NULL,NULL,"Any substance introduced into a living organism with therapeutic or diagnostic purpose."106,"anti amblyopic",NULL,"pharmaceutical","52217","2012-04-10 10:05:15","2015-10-27 17:48:18",NULL,NULL,"Any substance introduced into a living organism with therapeutic or diagnostic purpose."107,"anti amebic",NULL,"antimicrobial agent","33281","2012-04-10 10:05:15","2015-10-27 17:48:19",NULL,NULL,"A substance that kills or slows the growth of microorganisms, including bacteria, viruses, fungi and protozoans."108,"anti amnesic",NULL,"pharmaceutical","52217","2012-04-10 10:05:15","2015-10-27 17:48:19",NULL,NULL,"Any substance introduced into a living organism with therapeutic or diagnostic purpose."109,"anti amyloid-beta","An agent, such as an antibody, that lowers amyloid levels in an an Alzheimer affected brain.",NULL,NULL,"2012-04-10 10:05:15","2015-11-11 02:32:17",NULL,NULL,NULL110,"anti anacarditic",NULL,NULL,NULL,"2012-04-10 10:05:15","2012-04-10 10:05:15",NULL,NULL,NULL111,"anti anaphylactic",NULL,"pharmaceutical","52217","2012-04-10 10:05:15","2015-10-27 17:48:20",NULL,NULL,"Any substance introduced into a living organism with therapeutic or diagnostic purpose."112,"anti androgenic",NULL,"androgen antagonist","35497","2012-04-10 10:05:15","2015-10-27 17:48:20",NULL,NULL,"A compound which inhibits or antagonises the biosynthesis or actions of androgens."113,"anti anemic",NULL,"pharmaceutical","52217","2012-04-10 10:05:15","2015-10-27 17:48:21",NULL,NULL,"Any substance introduced into a living organism with therapeutic or diagnostic purpose."114,"anti anginal",NULL,"pharmaceutical","52217","2012-04-10 10:05:15","2015-10-27 17:48:21",NULL,NULL,"Any substance introduced into a living organism with therapeutic or diagnostic purpose."115,"anti angiogenic",NULL,"angiogenesis inhibitor","48422","2012-04-10 10:05:15","2015-10-27 17:48:22",NULL,NULL,"An agent and endogenous substances that antagonize or inhibit the development of new blood vessels."116,"anti angiotensic",NULL,"hormone antagonist","49020","2012-04-10 10:05:15","2015-10-27 17:48:22",NULL,NULL,"A chemical substance which inhibits the function of the endocrine glands, the biosynthesis of their secreted hormones, or the action of hormones upon their specific sites."117,"anti anorectic",NULL,"appetite regulator","50780","2012-04-10 10:05:15","2015-10-27 17:48:23",NULL,NULL,"An agent which regulates the physiologic mechanisms that control the appetite and food intake."118,"anti anorexic",NULL,"appetite regulator","50780","2012-04-10 10:05:15","2015-10-27 17:48:23",NULL,NULL,"An agent which regulates the physiologic mechanisms that control the appetite and food intake."119,"anti anoxic",NULL,"pharmaceutical","52217","2012-04-10 10:05:15","2015-10-27 17:48:24",NULL,NULL,"Any substance introduced into a living organism with therapeutic or diagnostic purpose."120,"anti anxiety",NULL,"pharmaceutical","52217","2012-04-10 10:05:15","2015-10-27 17:48:25",NULL,NULL,"Any substance introduced into a living organism with therapeutic or diagnostic purpose."121,"anti apertif",NULL,"pharmaceutical","52217","2012-04-10 10:05:15","2015-10-27 17:48:25",NULL,NULL,"Any substance introduced into a living organism with therapeutic or diagnostic purpose."