						IRREG	"O = Essential Oil(s) tested
C = Control(s) used (if any)
A = Activity(ies) tested
S = Species being tested
P = Parameters values = number of measurement types T = Time Sol = Solution Or = Origin Stg = Insect Stage ?? = Concentration"	ROTGRID = Columns with a values in it.																	
https://www.ncbi.nlm.nih.gov/pmc/articles/PMC5872290/		PMC5872290	Larvicidal and Pupaecidal			7				Effect of binary mixtures of individual compounds on the mortality against Culex quinquefasciatus pupae.															
https://www.ncbi.nlm.nih.gov/pmc/articles/PMC5885327/		PMC5885327	anti-trichomonal			1				In vitro anti-trichomonal activity of metronidazole (MTZ) and P. roseum essential oil (EO) against trophozoites of T. gallinae.	"Data are presented as mean ± SEM. Mean number of trophozoites×104.
a, b, c different letters in the same row indicate statistical significant difference (p<0.05)."														
https://www.ncbi.nlm.nih.gov/pmc/articles/PMC5885327/		PMC5885327	anti-trichomonal			2				In vivo anti-trichomonal activity of metronidazole (MTZ) and P. roseum essential oil (EO) against T. gallinae.	"Data are presented as Mean ± SEM. Mean number of trophozoites×104.
a, b, c different letters in the same row indicate statistical significant difference (p<0.05)."														
https://www.ncbi.nlm.nih.gov/pmc/articles/PMC5897738/		PMC5897738	Smooth Muscle Relaxant (Anti-contractile)?			3				Effects of drugs on the contractile response to RC crude extract (60 μg/ml) on guinea pig small intestine (mean ± SEM).	"Values significantly different from the respective control group are indicated by asterisks (∗). #methysergide (0.3 μM), SB204070 (1 μM) and Y25130 (1 μM). &10 μM of capsaicin for 10 min, followed by a 60-min washout period."														
https://www.ncbi.nlm.nih.gov/pmc/articles/PMC5897738/		PMC5897738	Smooth Muscle Relaxant (Anti-contractile)?			4				"Contractile effects of RC extract fractions on guinea pig ileum (longitudinally oriented preparations, mean ± SEM)."	Asterisks denote values significantly different from a pooled group of solvent effects (Kruskal–Wallis test for several unrelated samples).														
https://www.ncbi.nlm.nih.gov/pmc/articles/PMC5897738/		PMC5897738	Smooth Muscle Relaxant (Anti-contractile)?			5				Relaxing effect of RC crude extract and essential oil on the pre-contracted ileum.	"Atropine and tetrodotoxin (0.5 μM each) were present in the medium in order to inhibit the contractile effect of the RC extract. Tonic submaximal contraction was evoked with histamine (0.5 μM for 15 min). Values are given in %, where 100% means full relaxation reaching the pre-histamine values (mean ± SEM). Asterisks denote values significantly different from a pooled group of solvent effects (0.3 or 1 μl/ml of DMSO, see text) (Kruskal–Wallis test for several unrelated samples)."														
https://www.ncbi.nlm.nih.gov/pmc/articles/PMC5897738/		PMC5897738	Smooth Muscle Relaxant (Anti-contractile)?			6				Relaxant effects of RC extract fractions on pre-contracted guinea pig ileum (mean ± SEM).	100% relaxation denotes that tone returns to baseline. Asterisks denote values significantly different from a pooled group of solvent effects (0.3 or 1 μl/ml DMSO) (Kruskal–Wallis test for several unrelated samples).														
https://www.ncbi.nlm.nih.gov/pmc/articles/PMC5897738/		PMC5897738	Smooth Muscle Relaxant (Anti-contractile)?			7				Relaxant effects of flavonoids on pre-contracted guinea pig ileum (mean ± SEM).	100% relaxation denotes that tone returns to baseline. The solvent contained a maximum of 10% DMSO and had no relaxant effect in the volumes used.														
https://www.ncbi.nlm.nih.gov/pmc/articles/PMC5897738/		PMC5897738	Smooth Muscle Relaxant (Anti-contractile)?			8				"Contractile effect of RC extract on guinea pig urinary bladder strip, without pretreatment and following treatment with capsaicin or its solvent (mean ± SEM)."	#Solvent and time control for capsaicin. &Capsaicin was added and incubated for 10 min. This was followed by a 90-min washout period. ∗Significantly different from the ethanol control.														
https://www.ncbi.nlm.nih.gov/pmc/articles/PMC5902937/		PMC5902937	anti-arthritic			3		"Strangely, this article displays their last two tables in reverse order."		"Effect of milk thistle oil on egg albumin and BSA denaturation, during seed maturation"	"Values were expressed as means ± SD of triplicate experiments
a% of inhibition of egg albumin denaturation
b% of inhibition of bovine serum albumin (BSA) denaturation"														
https://www.ncbi.nlm.nih.gov/pmc/articles/PMC5902937/		PMC5902937	antioxidant and anti-arthritic			4		"Strangely, this article displays their last two tables in reverse order."		"Correlation coefficients (r) between policoanol content, antioxidant and anti-arthritic activities of milk thistle oil, during seed maturation"	"TPC Total Policosanol content
DPPH 1,1-diphenyl-2-picrylhydrazyl radical
ABTS 2,2′-azino-bis (3-ethyl-benzthiazoline-6-sulfonic acid)
EAD egg albumin denaturation
BSA bovine serum albumin denaturation"														
https://www.ncbi.nlm.nih.gov/pmc/articles/PMC5905380/		PMC5905380	Larvicidal			3				"LC50 and LC95 values for garlic essential oil, asafoetida essential oil, their combination, and one of their components (allyl disulfide) against Cx. pipiens and Cx. restuans larvae"	Values in parenthesis are 95% confidence limits.														
https://www.ncbi.nlm.nih.gov/pmc/articles/PMC5905380/		PMC5905380	Ovicidal			2				"Effect of garlic essential oil, asafoetida essential oil, and one of their components (allyl disulfide) on hatch rate of Culex eggs"															
https://www.ncbi.nlm.nih.gov/pmc/articles/PMC5918559/		PMC5918559	anthelmintic			2				Effects (mean percentage ± SE) of tested essential oils on inhibition of egg hatching of H. contortus	"Abbreviations: IC50, inhibitory concentration 50%; R2, nonlinear correlation coefficient
aNo statistically significant difference between positive control and treatments
bSignificant difference between positive control or treatments with negative control (ANOVA, followed by Tukey test; P < 0.05)"														
https://www.ncbi.nlm.nih.gov/pmc/articles/PMC5918559/		PMC5918559	anthelmintic (Inhibition)			3				Effects (mean percentage ± SE) of different concentrations of essential oils on inhibition of larval development of H. contortus	"Abbreviations:C50, inhibitory concentration 50%; R2, nonlinear correlation
aNo statistically significant difference between positive control and treatments
bSignificant difference between positive control or treatments with negative control (ANOVA, followed by Tukey test; P < 0.05)"														
https://www.ncbi.nlm.nih.gov/pmc/articles/PMC5918559/	https://www.ncbi.nlm.nih.gov/pmc/articles/PMC5918559/table/Tab4/?report=objectonly	PMC5918559	anthelmintic (Mortality)			4				Percentage of motility of H. contortus adult worns when exposed to different concentrations of essential oils	"Key: Control (+), levamisole 20 mg/ml; Control (-) 1, PBS + antibiotic (penicillin/streptomycin) 4% + tween 80 2%; Control (-) 2, PBS + antibiotic (penicillin/streptomycin) 4%
aNo statistically significant difference between positive control and treatments
bSignificant difference between positive control or treatments with negative control (ANOVA, followed by Tukey test; P < 0.05)"														
https://www.ncbi.nlm.nih.gov/pmc/articles/PMC5933010/		PMC5933010	antioxidant			4				Effects of MPEO on the hepatic antioxidant profile in CCl4-induced liver fibrosis.	Group 1: normal control; group 2: liver fibrosis control; group 3: MPEO-treated; group 4: MPEO control. Values are expressed as mean ± SE. Different superscripts mean significant differences between groups in the same column at p < 0.05. GSH: reduced glutathione; SOD: superoxide dismutase; CAT: catalase; TAC: total antioxidant capacity.														
https://www.ncbi.nlm.nih.gov/pmc/articles/PMC5933010/		PMC5933010	Improves Liver Functions (Enzyme modulation)			3				"Effects of MPEO on liver enzymes, NO content, and lipid peroxidation byproduct (MDA) in CCl4-induced liver fibrosis."	Group 1: normal control; group 2: liver fibrosis control; group 3: MPEO-treated; group 4: MPEO control. Values are expressed as mean ± SE. Different superscripts mean significant differences between groups in the same column at p < 0.05. ALT: alanine transaminase; AST: aspartate transaminase; NO: nitric oxide; MDA: malondialdehyde.														
https://www.ncbi.nlm.nih.gov/pmc/articles/PMC5933010/		PMC5933010	pathological grading (			5				Effect of MPEO on the pathological grading of CCl4-induced fibrotic liver in rats.	Group 1: normal control; group 2: liver fibrosis control; group 3: MPEO-treated; group 4: MPEO control. Data are presented as the mean of ten fields. n: number of rats. aSignificant difference from the control group at p < 0.01. bSignificant difference from model group at p < 0.05.														
https://www.ncbi.nlm.nih.gov/pmc/articles/PMC5933022/		PMC5933022	Antimicrobial			3				"Determination of minimum inhibitory concentration (MIC) of the oleogels containing different concentrations of thyme essential oil.
"															
https://www.ncbi.nlm.nih.gov/pmc/articles/PMC5933692/		PMC5933692	Anti-tumor			3				"Results of cell counting analysis in the five cell lines following treatment with antioxidant N-acetyl-L-cysteine (NAC) at two concentrations, 1 mM and 2 mM before exposure to the essential oil at the corresponding IC50.
Data are expressed as mean ± standard deviation (SD)."	"Different letters (a, b and c) in the column of the cell lines and treatments represent significant differences among the treatments of each cell line;
* differences when treatments are compared to the control; p < 0.05."														
https://www.ncbi.nlm.nih.gov/pmc/articles/PMC5933692/		PMC5933692	Antioxidant			4				Results of antioxidant activity performed with DPPH method (DPPH free radical scavenging activity).															
https://www.ncbi.nlm.nih.gov/pmc/articles/PMC5933692/		PMC5933692	Antioxidant?			2		Antioxidant?		IC50 values of the five cell lines treated with the essential oil of G. rosmarinifolia.															
https://www.ncbi.nlm.nih.gov/pmc/articles/PMC5937097/	https://www.ncbi.nlm.nih.gov/pmc/articles/PMC5937097/table/T2/?report=objectonly	PMC5937097	Antiparasitic and cytotoxicity			2				Antiparasitic and cytotoxicity activity of the essential oil of Piper tuberculatum	EOPT: Essential oil of Piper tuberculatum; NIFU: Nifurtimox; PENTA: Pentamidine; METRO: Metronidazole; AP: Anti-promastigote activity; AE: Anti-epimastigote activity; CTF: Cytotoxicity in Fibroblasts.														
https://www.ncbi.nlm.nih.gov/pmc/articles/PMC5940754/		PMC5940754	Insecticidal			2				"Relative susceptibility of key lepidopteran pests (i.e., S. frugiperda and A. gemmatalis) to the essential oil of S. guianensis and the synthetic insecticide indoxacarb (oxadiazine)."	*Tolerance ratio estimated by dividing the LC50 value obtained for S. frugiperda strains by the LC50 value obtained for A. gemmatalis strain.														
https://www.ncbi.nlm.nih.gov/pmc/articles/PMC5940754/		PMC5940754	Larvicidal			3				"Results of the analysis of variance for the general activity of 3rd instar larvae groups of key lepidopteran pests (i.e., S. frugiperda and A. gemmatalis) after 3, 6 and 16 h of exposure to the LC10 or LC50 of the S. guianensis essential oil estimated for each lepidopteran pest."	"S: insect species (i.e., S. frugiperda and A. gemmatalis); EOC: LC10 and LC50 values of the S. guianensis essential oil estimated for each lepidopteran pest."														
https://www.ncbi.nlm.nih.gov/pmc/articles/PMC5940754/		PMC5940754	multivariate analysis of variance for the walking behavior			4		Not sure how to describe this activity		"Results of the multivariate analysis of variance for the walking behavior of the 3rd instar larvae of key lepidopteran pests (i.e., S. frugiperda and A. gemmatalis) in arenas treated with either the LC10 or LC50 of the oil of S. guianensis."	"T: time of exposure (i.e., 3, 6 and 16 h); S: insect species (i.e., S. frugiperda and A. gemmatalis); EOC: LC10 and LC50 values of the S. guianensis essential oil estimated for each lepidopteran pest."														
https://www.ncbi.nlm.nih.gov/pmc/articles/PMC5952513/		PMC5952513	Larvicidal			2				"Larvicidal activity of Zanthoxylum acanthopodium essential oil, estragole and eucalyptol against fourth instar Anopheles sinensis larvae"	"Each datum represents the mean of five replicates, each set up with 20 individuals (n = 100)
LC values are considered significantly different when 95% CI fail to overlap
95% CI confidence interval at 95% confidence level
aThe significance level is more than 0.05. A heterogeneity factor is used in the calculation of confidence limits
"														
https://www.ncbi.nlm.nih.gov/pmc/articles/PMC5952513/		PMC5952513	Larvicidal			3				"Larvicidal activity of Zanthoxylum acanthopodium essential oil, estragole and eucalyptol against fourth instar Anopheles anthropophagus larvae
"	"LC values are considered significantly different when 95% CL fail to overlap
95% CI confidence interval at 95% confidence level
aThe significance level is more than 0.05, a heterogeneity factor is used in the calculation of confidence limits
"														
https://www.ncbi.nlm.nih.gov/pmc/articles/PMC5958151/		PMC5958151	antifungal			3				Minimal inhibitory concentration (MIC) (μl/ml) of tested essential oils	"R, resistant"														
https://www.ncbi.nlm.nih.gov/pmc/articles/PMC5960548/		PMC5960548	Antioxidant			2				Antioxidative activity of the essential oil of Melaleuca alternifolia.															
https://www.ncbi.nlm.nih.gov/pmc/articles/PMC5963643/		PMC5963643	Antiradical / Antioxidant			2				Antiradical activities and linoleic acid oxidation inhibitions of O. majorana essential oil and positive controls.	"BHT, butylated hydroxytoluene; DPPH, 2,2-diphenyl-1-picrylhydrazyl; I%, inhibition in percentage."														
https://www.ncbi.nlm.nih.gov/pmc/articles/PMC5970210/		PMC5970210	Acaricidal			1				"Acaricidal activities of the essential oils of M. officinalis in France, Ireland, and Serbia and synthetic acaricide against D. farinae and D. pteronyssinus. using a contact + fumigant toxicity bioassay."	"(aLD50/LD90 is the average of 3 determinations, with 30 adult mites per replication. bRT50, Relative toxicity = LD50 value of DEET/LD50 value of each compound; Exposed for 24 h)."														
https://www.ncbi.nlm.nih.gov/pmc/articles/PMC5970210/		PMC5970210	Acaricidal			2				"Acaricidal activities of major components of the essential oils of M. officinalis cultivated in France, Ireland, and Serbia against D. farinae and D. pteronyssinus using a contact + fumigant toxicity bioassay."	"aLD50/ LD90 is the average of 3 determinations, with 30 adult mites per replication; Exposed for 24 h. bColor deformation effect. cNo activity. dNot observed, eObserved."														
https://www.ncbi.nlm.nih.gov/pmc/articles/PMC5970210/		PMC5970210	Acaricidal			3				"Route of acaricidal action of M. officinalis oil (France) and 3,7-dimethyl-2,6-octadienal against D. farinae and D. pteronyssinus using a vapor-phase toxicity bioassay."	aTreatment with ca. two-fold LD90 value of each sample; Exposed for 24 h. bEach experiment was performed 3 times and the data averaged. cAccording to Student’s t-test.														
https://www.ncbi.nlm.nih.gov/pmc/articles/PMC5970210/		PMC5970210	Acaricidal			4				"Fumigant toxicity of M. officinalis oil (France) and 3,7-dimethyl-2,6-octadienal against D. farinae and D. pteronyssinus covered with different thicknesses of non-woven fabric."	"aTreatment with ca. two-fold LD90 value of each sample; Exposed for 24 h. bEach experiment was performed 3 times and the data averaged; Means within a column followed by the same letter are not significantly different (P = 0.05, Scheffé test)."														
https://www.ncbi.nlm.nih.gov/pmc/articles/PMC5970210/		PMC5970210	Acaricidal			5				"Effectiveness of three spray formulations containing M. officinalis oil (France) and 3,7-dimethyl-2,6-octadienal against D. farinae and D. pteronyssinus using direct and indirect application methods during a 4 h exposure."	"aTreatment with ca. two-fold LD90 value of each sample; Exposed for 24 h. bEach experiment was performed 3 times and the data averaged; Means within a column followed by the same letter are not significantly different (P = 0.05, Scheffé test). cA, direct application method; B, indirect application method."														
https://www.ncbi.nlm.nih.gov/pmc/articles/PMC5977410/		PMC5977410	Antioxidant			3				"Antioxidant effect on DPPH radicals, superoxide radicals, scavenging ability on ABTS radicals and reducing power of P. lentiscus essential oil."	Values are expressed as mean ± SD of three measurements. GAE: acid galic.														
https://www.ncbi.nlm.nih.gov/pmc/articles/PMC6011056/		PMC6011056				2				"Minimum inhibitory concentration (MIC) and minimum bactericidal concentration (MBC) values of essential oils from C. zeylanicum and C. cassia stems, (E)-cinnamaldehyde and oxacillin (mg/ml) on bacteria."															
https://www.ncbi.nlm.nih.gov/pmc/articles/PMC6011056/		PMC6011056				3				"Minimum concentration of essencial oil from C. cassia (EOCc) and C. zeylanicum (EOCz) stems, (E)-cinnamaldehyde and oxacillin (mg/ml) reduce biofilm biomass by 100% in comparison to normal biofilm growth."															
https://www.ncbi.nlm.nih.gov/pmc/articles/PMC6015887/		PMC6015887				2				https://www.ncbi.nlm.nih.gov/pmc/articles/PMC6015887/	"Growth of C. acutatum in the presence of CEO. Medium used: PDA. Inoculating in dark at 25°C. Growth: ++++, very good; +++, good; ++, fair; +, little; -, no growth. Values are mean (n = 3)."														